{"$schema":"https://json-schema.org/draft/2020-12/schema","$id":"https://quirk.systems/schemas/goal.schema.json","title":"Quirk Goal","type":"object","additionalProperties":false,"required":["goal_id","area_ref","title","desired_state","evidence_of_completion","owner_ref","status","facts","constraints"],"properties":{"goal_id":{"type":"string","pattern":"^goal\\.[a-z0-9._-]+$"},"area_ref":{"type":"string"},"title":{"type":"string"},"desired_state":{"type":"string","minLength":1},"evidence_of_completion":{"type":"array","items":{"type":"string"},"minItems":1,"uniqueItems":true},"owner_ref":{"type":"string"},"status":{"enum":["candidate","active","blocked","achieved","abandoned","superseded"]},"time_horizon":{"type":["string","null"]},"facts":{"type":"array","items":{"type":"string"},"minItems":1,"uniqueItems":true},"constraints":{"type":"array","items":{"type":"string"},"uniqueItems":true},"dependencies":{"type":"array","items":{"type":"string"},"uniqueItems":true},"authority_required":{"type":"array","items":{"type":"string"},"uniqueItems":true},"metadata":{"type":"object"}}}