{"goal_id":"goal.deck-grammar.candidate-pack","area_ref":"area.quirk-architecture","title":"Create a governed Deck Grammar candidate pack","desired_state":"A reviewable, executable Deck Grammar candidate pack exists with fifteen schemas, a Hand compiler, two presets, eleven adversarial fixtures, canonical Quirk Format templates, and evidence that different Hands change the approach without changing truth, ownership, or authority.","evidence_of_completion":["all fifteen JSON Schemas validate","the Hand compiler produces valid Deck and Hand objects","Canon Architect and BryMinn Studio compile the same Goal","goal facts, owned-card snapshot, and authority snapshot remain identical","active cards and approach differ by Preset","all eleven adversarial fixtures pass","GitHub Actions emits a conformance artifact"],"owner_ref":"human.bryan","status":"active","time_horizon":"candidate proof","facts":["GitHub candidate files remain subordinate to human admission until approved","Card rarity, quality, access, and authority are independent dimensions","Cards are interface projections of Quirk Objects rather than replacements for those objects","Premium access cannot expand authority","The same Goal must be preserved across both Preset compilations"],"constraints":["no manifest activation","no Canon promotion","no production deployment","no automatic ownership mutation","no persistent Hand without consent"],"dependencies":["program.quirk-sync-control-plane","skill.quirk-intent-shaper"],"authority_required":["authority.human.deck-grammar-admission"],"metadata":{"same_goal_live_proof":true}}